,dia_no,new_dia_no,old_goal,new_goal,dia
447,454,447,"You are looking for a place to stay. The hotel should be in the expensive price range and should be in the type of guesthouse. The hotel should include free wifi. If there is no such hotel, how about one that is in the cheap price range. Once you find the hotel you want to book it for 2 people and 4 nights starting from saturday. If the booking fails how about different hotel in the same  pricerange. Make sure you get the reference number","You are looking for a place to stay. The hotel should be in the expensive price range and should be in the type of guesthouse. The hotel should include free wifi. If there is no such hotel, how about one that is in the cheap price range. Once you find the hotel you want to book it for 2 people and 4 nights starting from saturday. If the booking fails how about different hotel in the same  pricerange. Make sure you get the reference number","user: I'm looking for an upscale guesthouse.
system: Your are looking for an upscale guesthouse. I can help you with that. There are a few options, what area would you like?
user: I don't care about the area. All that matters to me is that it has free wifi.
system: I don't have any upscale guesthouses available. Is there a different price range I can help you find?
user: Is there any in the cheap price range then?
system: How about the Alexander Bed and Breakfast in the centre?  It is a cheap guesthouse with free WIFI.
user: Sounds great. I need to be there Saturday and we will be staying 4 nights. 
system: I am sorry, there is no availability for those dates. Would you like me to try to find another hotel? 
user: Yes let's try another hotel in the same price range.
system: I was able to get you into the El Shaddai and your reference number is JG24DZVF.
user: Thank you so much for your help.
system: Is there anything else that you need today?
user: As long as my reservation is for 2 people, we are set. Thank you!
system: Okay great. Glad I could be of help. Enjoy your stay.
user: Thank you so much. I'm sure I will.
system: Have a great day! Good-Bye."
448,455,448,You are looking for a place to stay. The hotel should be in the type of guesthouse and should have a star of 4. The hotel should include free parking. Once you find the hotel you want to book it for 1 people and 3 nights starting from sunday. If the booking fails how about different hotel in the same  pricerange. Make sure you get the reference number,You are looking for a place to stay. The hotel should be in the type of guesthouse and should have a star of 4. The hotel should include free parking. Once you find the hotel you want to book it for 1 people and 3 nights starting from sunday. If the booking fails how about different hotel in the same  pricerange. Make sure you get the reference number,"user: I would like a guesthouse, four star. 
system: The allenbell is a 4-star guesthouse in the east. Would you like to make a booking?
user: does it include free parking?
system: It includes free parking.   Would you like to book a room at this hotel?
user: Yes, please book it for 1 person and 3 nights starting from sunday.
system: I'm very sorry. That booking was unavailable. Would you like to find another hotel?
user: Sure.  Any guesthouse in the same price range would be fine.
system: I have booked you a room at the Autumn House. Their address is 710 newmarket road. Phone number is 01223575122. Reference number is : YU3MOAHH.
user: Thank you for the reference number YU3MOAHH. Goodbye.
system: Let us know if you need further help."
449,456,449,You are looking for a place to stay. The hotel should have a star of 4 and should include free wifi. The hotel doesn't need to have free parking and should be in the moderate price range. Once you find the hotel you want to book it for 6 people and 3 nights starting from wednesday. If the booking fails how about different hotel in the same  pricerange. Make sure you get the reference number,You are looking for a place to stay. The hotel should have a star of 4 and should include free wifi. The hotel doesn't need to have free parking and should be in the moderate price range. Once you find the hotel you want to book it for 6 people and 3 nights starting from wednesday. If the booking fails how about different hotel in the same  pricerange. Make sure you get the reference number,"user: Can you find me a 4 star hotel with wi-fi?
system: Yes I have many options in different parts of town, mostly in the cheap to moderate price range do you have any preferences for where you stay?
user: I would like it to be in the moderate price range please.
system: There are 11 options located in the east, north, and south. What location would you prefer?
user: The area doesn't matter. I need one that can accommodate 6 people for 3 nights starting on Wednesday.
system: Okay I booked you at the Acorn Guest House. Your reference number is Z0322EQ3. Is there anything else I can help you with?
user: No, that's all I need. Thanks!
system: You're welcome. Have a nice day!"
450,457,450,"You are looking for a place to stay. The hotel should be in the type of guesthouse and should be in the centre. The hotel doesn't need to have free parking. If there is no such hotel, how about one that has free parking. Make sure you get address, price range, and star of the hotel","You are looking for a place to stay. The hotel should be in the type of guesthouse and should be in the centre. The hotel doesn't need to have free parking. If there is no such hotel, how about one that has free parking. Make sure you get address, price range, and star of the hotel","user: I live in the centre of town and want to see if I can find a reasonable room for my parents to stay while they are visiting. 
system: How about the Alexander bed and breakfast in the centre?  It is a cheap 4 star guesthouse with free internet and wifi.
user: That sounds like it might work.  Could you check availability for two people this weekend?
system: What day are they arriving, and how many nights are they staying?
user: I am unsure at this time. 
system: Okay, would you like some more information about that hotel?
user: Can you tell me what the address is?
system: The address is 56 saint barnabas road.
user: Does this place include free parking?
system: The alexander bed and breakfast is a cheap, 4 star guesthouse in the centre area, It has wifi and parking. Does this fit your needs?
user: You have been very helpful.  I have everything I need, thanks.  Bye
system: I am glad to help. Have a nice day.  Bye."
451,458,451,You are looking for a particular hotel. Its name is called el shaddai. Once you find the hotel you want to book it for 1 people and 5 nights starting from tuesday. Make sure you get the reference number,You are looking for a particular hotel. Its name is called el shaddai. Once you find the hotel you want to book it for 1 people and 5 nights starting from tuesday. Make sure you get the reference number,"user: Hello, I would like to find the el shaddai hotel. Can you help me?
system: The El Shaddai Hotel is located at 41 warkworth street, would yo+u like the phone number?
user: Can I book a stay there for 1 person for 5 nights starting tuesday please?
system: Your booking was successful, reference number is 8T4AJ6P9, 1 person for 5 nights starting Tuesday at the El Shaddai. Can I help you with anything else? 
user: Nope, that'll do it. Thanks for your help!
system: Thank you, goodbye."
452,459,452,You are looking for a place to stay. The hotel should be in the cheap price range and should be in the west. The hotel should be in the type of guesthouse. Make sure you get whether they have internet and phone number,You are looking for a place to stay. The hotel should be in the cheap price range and should be in the west. The hotel should be in the type of guesthouse. Make sure you get whether they have internet and phone number,"user: Do they have any cheap places to stay on the west side?
system: There is 1 guesthouse and 1 hotel that are cheap on the west side. Which one do you prefer?
user: The guest house, please.
system: finches bed and breakfast is a cheap guesthouse in the west area. Would you like me to book a room for you?
user: No thank you, but could you tell me the phone number? And do they have free internet?
system: Yes they do have free internet, and the phone number is 01223276653.
user: Thank you so much!
system: You're welcome. Have a great day."
453,460,453,You are looking for a particular hotel. Its name is called cityroomz. Once you find the hotel you want to book it for 7 people and 4 nights starting from saturday. Make sure you get the reference number,You are looking for a particular hotel. Its name is called cityroomz. Once you find the hotel you want to book it for 7 people and 4 nights starting from saturday. Make sure you get the reference number,"user: Could you help me find Cityroomz, please?
system: I sure can. CityRoomz is located in the centre of town. They offer free wifi. They are at Sleeperz Hotel, Station Road. Their phone number is 01223304050. 
user: Can you book a room for me there? We'll be arriving on Saturday and need to stay 4 nights. There will be 7 of us staying.
system: I was able to book Cityroomz for you on Saturday for 4 night, 7 people. Your reference number is 5B7M73DK. Is there anything else I can help with?
user: Nope, that'll be all, thanks. Bye!
system: Thank you for contacting Cambridge TownInfo centre. Have a great day!"
454,461,454,"You are looking for a place to stay. The hotel should be in the moderate price range and should have a star of 3. The hotel should include free wifi and doesn't need to have free parking. If there is no such hotel, how about one that has free parking. Once you find the hotel you want to book it for 4 people and 2 nights starting from friday. If the booking fails how about different hotel in the same  pricerange. Make sure you get the reference number","You are looking for a place to stay. The hotel should be in the moderate price range and should have a star of 3. The hotel should be in type of hotel, include free wifi and free parking. If there is no such hotel, how about other star ratings or a guesthouse. Once you find the hotel you want to book it for 4 people and 2 nights starting from friday. If the booking fails how about different hotel in the same pricerange. Make sure you get the reference number","user: Can you find a 3 star hotel in the moderate price range?
system: Just to clarify, is it a hotel you need, or will a guest house serve? Because I have 4 guest houses matching your needs, but no actual hotels.
user: No it needs to be a hotel that includes wifi
system: I'm sorry, I don't have anything that matches that description, but I do have two 2-star hotels with WIFI in the moderate price range.
user: Does one have free parking?
system: Two do, the ashley hotel and the lovell lodge.
user: Actually, a guest room will be fine.  As long as it is a 3 star moderate. I'd like both free wifi and free parking.
system: I have only two star hotels, would you mind restating the exact criteria you need in a room please?
user: I need a moderate hotel, free parking for 4 people, 2 nights on friday. I need a reference number too please
system: And you said a guesthouse would be fine, correct? I have the Bridge Guest House which is a 3 star with free internet and parking. 
user: Yes, book it please.
system: That one is unavailable. Would you like me to try one of the others?
user: Yes a hotel in the same price range.
system: I booked a room for you at the Hamilton Lodge on Chesterton Road.  Your reference number is CU50DW9Y.  Can I help you with anything else today?
user: No. That is it. Thanks so much for your help!
system: You're welcome. Good-bye."
455,462,455,You are looking for a place to stay. The hotel should include free parking and should be in the north. The hotel should be in the type of guesthouse. Once you find the hotel you want to book it for 8 people and 4 nights starting from wednesday. Make sure you get the reference number,You are looking for a place to stay. The hotel should include free parking and should be in the north. The hotel should be in the type of guesthouse. Once you find the hotel you want to book it for 8 people and 4 nights starting from wednesday. Make sure you get the reference number,"user: Hello, I am looking for a hotel in the north part of town. The hotel needs to include free parking.
system: How about arbury lodge guesthouse? It's moderately priced.
user: That sounds great! Can you tell me more about it?
system: The Arbury Lodge has 4 stars and is located at 82 Arbury road, in the north. They offer both free wifi and parking. Would you like to book a room?
user: Yes, please book for 4 nights starting Wednesday. There will be 8 of us. 
system: You are booked and your reference number is NY842ATU. Can I help you with anything else today?
user: That should do it! Thank you! 
system: Thank you, goodbye."
456,463,456,You are looking for a place to stay. The hotel should include free parking and should be in the cheap price range. The hotel should have a star of 4 and should include free wifi. Make sure you get phone number,You are looking for a place to stay. The hotel should include free parking and should be in the cheap price range. The hotel should have a star of 4 and should include free wifi. Make sure you get phone number,"user: Can you find me a cheap hotel with free parking?
system: Most of the cheap options we have are guesthouses, though I do have one hotel in the west. Do you have a preference?
user: How many stars does this hotel have, and does it have wifi? 
system: It has a 4 star rating and wifi yes.
user: Can you tell me the name and phone number of that hotel please? 
system: It is the Cambridge Belfry hotel and the phone number is 01954714600. Do you need any other details?
user: No, actually that did it. I have all I need. Thanks again. Goodbye. 
system: Have a nice day, goodbye!"
457,464,457,You are looking for a particular hotel. Its name is called gonville hotel. Once you find the hotel you want to book it for 1 people and 3 nights starting from saturday. If the booking fails how about different hotel in the same  pricerange. Make sure you get the reference number,You are looking for a particular hotel. Its name is called gonville hotel. Once you find the hotel you want to book it for 1 people and 3 nights starting from saturday. If the booking fails how about different hotel in the same  pricerange. Make sure you get the reference number,"user: I'm looking for a certain hotel someone recommended, I think it's called the Gonville?
system: I have the gonville hotel. It is in the centre area of town. Would you like to make a booking today?
user: Yes, please, I need a room for 3 nights for one person, starting on Saturday.
system: I am sorry there are no rooms available at that time,can I help you find another hotel?
user: How about a different hotel in the same price range please?
system: How about the University Arms Hotel? It is in the same price range.
user: Is that rated similar to the other one?
system: The rating is actually one star better. Is that one fine?
user: Yes please boook me that one.
system: All right, I have you booked at the University Arms with reference number JAD762EV. Can I help you with anything else?
user: No thank you. You have been very helpful with all your assistance.
system: Pleasure all mine. Have a nice stay!"
458,465,458,You are looking for a place to stay. The hotel should include free parking and should be in the type of guesthouse. The hotel should have a star of 3 and should include free wifi. Once you find the hotel you want to book it for 4 people and 3 nights starting from wednesday. If the booking fails how about different hotel in the same  pricerange. Make sure you get the reference number,"You are looking for a place to stay. The hotel should include free parking and should be in the type of guesthouse. The hotel should have a star of 3 and should include free wifi. If there is no such guesthouse, end the conversation. Once you find the hotel you want to book it for 4 people and 3 nights starting from wednesday. If the booking fails how about different hotel in the same  pricerange. Make sure you get the reference number","user: I am looking for a guesthouse to stay in that offers free parking.
system: I show 21 responses. May I have the location you are interested in? Also a price range would help refine our search
user: I would like to stay in the Centre in the expensive price range. 
system: I'm sorry there are no matches fitting your specifications. Would you like a different price range or a different area possibly?
user: I'm sorry. The area and price range do not matter. I need a 3 star guesthouse with free wifi please.
system: 	I'm sorry there are no matches fitting your specifications. Would you like a different price range or a different area possibly?"
459,466,459,You are looking for a place to stay. The hotel should include free wifi and should be in the north. The hotel should be in the moderate price range. Once you find the hotel you want to book it for 4 people and 5 nights starting from wednesday. If the booking fails how about different hotel in the same  pricerange. Make sure you get the reference number,You are looking for a place to stay. The hotel should include free wifi and should be in the north. The hotel should be in the moderate price range. Once you find the hotel you want to book it for 4 people and 5 nights starting from wednesday. If the booking fails how about different hotel in the same  pricerange. Make sure you get the reference number,"user: Hello, I'm looking for a place to stay on the north end. I'd like a place with free wifi.
system: Can I get a hotel type you are looking  for?
user: It needs to be in the moderate price range
system: There are 8 guesthouses and two hotels meeting your needs. Do  you have a preference as to type?
user: No, I don't have a preference. I need it for 4 people and 5 nights starting from Wednesday.
system: Here is the reservation in Avalon guesthouse, the address is 62 gilbert road, post code cb43pd, and the phone is 01223353071.
user: Thanks that's all I need today,goodbye.
system: Your welcome and thanks for using Cambridge TownInfo centre!"
460,467,460,"You are looking for a place to stay. The hotel should have a star of 4 and should include free parking. The hotel should be in the type of guesthouse and should be in the cheap price range. Make sure you get area, whether they have internet, and postcode","You are looking for a place to stay. The hotel should have a star of 4 and should include free parking. The hotel should be in the type of guesthouse and should be in the cheap price range. Make sure you get area, whether they have internet, and postcode","user: I am looking for a place to stay. The hotel should have a star of 4 and should include free parking
system: The Cambridge Belfry fits your request.  Would you like to book a room?
user: Sorry. I prefer a guesthouse. Does the Cambridge Belfry meet that requirement?
system: I apologize, it does not. Do you have a specific price range in mind?
user: Yes, it should be in the cheap price range.
system: How about allenbell? It looks lovely.
user: Sounds interesting! What area is it in?
system: The allenbell is in the east area. Would you like a reservation?
user: Do they have internet?
system: Yes, the allenbell meets all your needs. Shall I book the guesthouse for you?
user: Wait, first let me know: do they have internet access?
system: Yes, the Allenbell has internet service. Would you like me to book this location for you?
user: I don't need a booking yet. I do need the postcode, though.
system: The postcode for the Allenbell is cb13js. Is there anything else I can help you with today?
user: Could you also please tell me the area that is in?
system: Sure, the Allenbell Guesthouse is located in the east. Can I help with anything else? 
user: No, I think that's all I need. Thank you for your help today.
system: You are more than welcome!"
461,468,461,"You are looking for a place to stay. The hotel should be in the expensive price range and should be in the north. The hotel should include free parking and should include free wifi. If there is no such hotel, how about one that is in the cheap price range. Make sure you get phone number and hotel type","You are looking for a place to stay. The hotel should be in the expensive price range and should be in the north. The hotel should include free parking and should include free wifi. If there is no such hotel, how about one that is in the cheap price range. Make sure you get phone number and hotel type","user: Hi, I need a place to stay. Something expensive on the north side. 
system: I'm sorry, but there is not a single expensive hotel or guesthouse on the north side of town. Would you like a different area or perhaps a different price range?
user: How about any part of town with free parking and free wifi?
system: I have 5 different options for you. My recommendation would be the Huntingdon Marriott Hotel. Its in the west side and is expensive with a 4-star rating. Would that work? 
user: Is there something in the cheap price range?
system: There are 2 cheap guesthouses if you still want to stay on the north side of town, they both have internet and parking. Would either of these work?
user: Yes please. I'll need the phone number and hotel type please.
system: All right, the Worth House is a guesthouse that should meet your needs. The phone number is 01223316074. What other informatoin do you need?
user: That's all I need. Thank you.
system: Thanks for using the Cambridge TownInfo centre, and enjoy your stay in our city!"
462,469,462,You are looking for a place to stay. The hotel should be in the type of guesthouse and should include free wifi. The hotel should be in the moderate price range. Make sure you get area and star of the hotel,You are looking for a place to stay. The hotel should be in the type of guesthouse and should include free wifi. The hotel should be in the moderate price range. Make sure you get area and star of the hotel,"user: Could I ask for your help in finding a guesthouse to put my friends up in nearby?
system: Of course! Cambridge boasts many wonderful guesthouses. What did you have in mind?
user: Some place moderately priced, with free wifi.
system: I have 14 options spread out all over town. Do you have a preference as to the area you want to stay? 
user: I don't have a preference. Which one looks best to you? 
system: The A and B Guest House is on the east side of town and has 4 stars. Would you like me to book it for you?
user: No thank you, that is all I needed. Have a great day!
system: You're welcome. Please contact us if you need more information or would like to make a reservation. Have a wonderful day!
user: I will be sure to do that.
system: Here is the number for the guesthouse if you have any further inquiries: 01223315702. Thank you!"
463,470,463,You are looking for a place to stay. The hotel doesn't need to have free parking and should be in the moderate price range. The hotel should be in the east. Once you find the hotel you want to book it for 2 people and 4 nights starting from tuesday. If the booking fails how about friday. Make sure you get the reference number,You are looking for a place to stay. The hotel doesn't need to have free parking and should be in the moderate price range. The hotel should be in the east. Once you find the hotel you want to book it for 2 people and 4 nights starting from tuesday. If the booking fails how about friday. Make sure you get the reference number,"user: I am looking for a place to stay. The hotel doesn't need to have free parking and should be in the moderate price range
system: Alright. what area do you want to stay in?
user: I would like to stay in the east.
system: There are three locations which fit your needs, sir. The Warkworth House is an excellent choice.
user: Okay, I want to book it for 2 people and 4 nights starting from Tuesday.
system: Unfortunately, the hotel couldn't accommodate you. would you like to change the day or time?
user: What about on Friday?
system: Booking was successful. Reference number is : 49R7ARU6.
user: Great, thanks so much!
system: Thank you goodbye"
464,471,464,You are looking for a place to stay. The hotel should include free parking and should have a star of 0. The hotel should be in the cheap price range. Once you find the hotel you want to book it for 4 people and 4 nights starting from monday. If the booking fails how about different hotel in the same  pricerange. Make sure you get the reference number,You are looking for a place to stay. The hotel should include free parking and should have a star of 0. The hotel should be in the cheap price range. Once you find the hotel you want to book it for 4 people and 4 nights starting from monday. If the booking fails how about different hotel in the same  pricerange. Make sure you get the reference number,"user: Hi, I'm looking for a place to stay with free parking and zero stars.
system: I have 2. City centre north b and b in the north and the el shaddai in the centre. Which one would you prefer?
user: the el shaddai in the centre
system: Ok no problem, when would you like the room booked for?
user: I need it for four people and four nights starting Monday.
system: Booking was unsuccessful. Want to find another hotel?
user: Lets try City centre north b and b, if that is not successful, any hotel in the same price range
system: The A and B was indeed successful and your reference number is II677Z30.
user: Thank you so much for your help.  Have a nice day.  Bye.
system: You are very welcome. Thank you for contacting the Cambridge TownInfo centre. Good bye."
