,dia_no,new_dia_no,old_goal,new_goal,dia
153,155,153,"You are looking for a place to stay. The hotel should be in the moderate price range and should have a star of 4. The hotel doesn't need to have free parking and should be in the north. Make sure you get hotel type, whether they have internet, and postcode","You are looking for a place to stay. The hotel should be in the moderate price range and should have a star of 4. The hotel doesn't need to have free parking and should be in the north. Make sure you get hotel type, whether they have internet, and postcode","user: I need to find a 4 star hotel that has moderate price.
system: There are 11 possible choices. Do you have any additional preferences?
user: Yes I would like it to be on the North part of town.
system: There are quite a few guesthouses in that area.  Would a guesthouse meet your needs?
user: Yes a guesthouse would be fine. Does it have internet? And what is it's postcode?
system: Yes, the Acorn Guest House has internet.
user: Great, that's perfect. Thanks for your help!
system: And the postcode is cb41da if you still need that information. Is there anything else I can help with?
user: No that's all for now. Thank you. 
system: Have a great day!"
154,156,154,You are looking for a particular hotel. Its name is called avalon. Make sure you get price range and phone number,You are looking for a particular hotel. Its name is called avalon. Make sure you get price range and phone number,"user: Can you give me some information on the Avalon Hotel? 
system: I'd be happy to. The Avalon is a guesthouse located on the north side. It's moderately priced, has 4-stars and offers free wifi. Would you like to book a room?
user: Not at the moment, can I have their phone number?
system: Certainly, the phone number is 01223353071. Is there anything else I can help you with?
user: No, that covers it.  Thanks!
system: Great! Have a wonderful day! Goodbye!"
155,157,155,You are looking for a particular hotel. Its name is called allenbell. Once you find the hotel you want to book it for 8 people and 5 nights starting from tuesday. Make sure you get the reference number,You are looking for a particular hotel. Its name is called allenbell. Once you find the hotel you want to book it for 8 people and 5 nights starting from tuesday. Make sure you get the reference number,"user: Yes, I am trying to find a hotel by the name of allenbell. Can you help me?
system: I've located Allenbell Guesthouse. It's in the east at address 517a coldham lane postcode cb13js. The contact number is 01223210353. Would you like to book a room? 
user: Yes. I would like to book it for 8 people and 5 nights starting from tuesday.
system: Your booking is confirmed, 8 people for 5 nights starting Tuesday at the Allenbell. Booking reference is YLPAOS85. Do you need anything else? 
user: No, thank you. Thanks for your help.
system: Thank you for choosing the Cambridge TownInfo centre. Have a great day!"
156,158,156,You are looking for a place to stay. The hotel should include free parking and should include free wifi. The hotel should have a star of 3. Once you find the hotel you want to book it for 6 people and 3 nights starting from wednesday. If the booking fails how about different hotel in the same  pricerange. Make sure you get the reference number,You are looking for a place to stay. The hotel should include free parking and should include free wifi. The hotel should have a star of 3.,"user: I am looking for a hotel that can offer me both free wifi and free parking.
system: There are 29 hotels that meet your criteria. Do you have a preferred location in the city so we can narrow down your choices?
user: The location does not matter but I need a 3 star hotel.
system: bridge guest house is a 3 star and a nice place.Do you want the address ?"
157,159,157,You are looking for a particular hotel. Its name is called university arms hotel. Once you find the hotel you want to book it for 5 people and 5 nights starting from wednesday. If the booking fails how about different hotel in the same  pricerange. Make sure you get the reference number,You are looking for a particular hotel. Its name is called university arms hotel. Once you find the hotel you want to book it for 5 people and 5 nights starting from wednesday. If the booking fails how about different hotel in the same pricerange (moderate). Make sure you get the reference number,"user: I want some information on the university arms hotel please
system: The university arms hotel is an expensive hotel in the centre with internet and parking. Would you like me to make a booking?
user: Yes. I need rooms for 5 people for 5 nights, starting wednesday. 
system: Unfortunately, the hotel is unavailable at that time. Would you like me to find another hotel?
user: Are there any listings for a moderately priced hotel in that area?
system: a and b guest house is moderately priceed.Would you like me to book you ?"
158,160,158,"You are looking for a place to stay. The hotel should be in the centre and should include free parking. The hotel should have a star of 4. Make sure you get phone number, postcode, and whether they have internet","You are looking for a place to stay. The hotel should be in the centre and should include free parking. The hotel should have a star of 4. Make sure you get phone number, postcode, and whether they have internet","user: I'm needing a place to stay that is in the centre of town. 
system: I have several options for you in the center of town. Do you have a price range in mind?
user: I don't care about the price range, but I need free parking, please.
system: I have narrowed it down to 4 options. I have 2 cheaper ones that are guesthouses, and 2 expensive hotels. Do you have a preference? 
user: I would prefer a hotel with 4 stars please, are either of those 4 stars with free parking? And also do either have free wifi?
system: You might be interested in the University Arms Hotel.  Should I book you a room?
user: I don't want to book it right now. Can I get the phone number and postcode, please?
system: Yes, the phone number is 01223351241 and the postcode is cb21ad. May I help you with anything else?
user: Just to verify, the University Arms offers free WiFi and free parking?
system: Indeed, they do!
user: Great! That is wonderful! Have a great day! 
system: I hope you have a wonderful day as well."
159,161,159,You are looking for a place to stay. The hotel should be in the north and should include free parking. The hotel should include free wifi and should be in the moderate price range. Once you find the hotel you want to book it for 1 people and 3 nights starting from saturday. If the booking fails how about 1 nights. Make sure you get the reference number,You are looking for a place to stay. The hotel should be in the north and should include free parking. The hotel should include free wifi and should be in the moderate price range. Once you find the hotel you want to book it for 1 people and 3 nights starting from saturday. If the booking fails how about 1 nights. Make sure you get the reference number,"user: I am visiting in the northern area of town. I need to find me a place to stay for the night. Can you help?
system: There are 11 guesthouses and 2 hotels in the north. Do you have a preference as to type or other requirements?
user: I'd like it to have free parking and free wifi.
system: The arbury lodge guesthouse is the north area with free parking and wifi. Would you care to book a room here?
user: Is the Arbury Lodge moderately priced? If so, I would like to book a room for 1 person for 3 nights on Saturday. 
system: The Arbury Lodge is unavailable for 3 nights on Saturday. Can you select another day or for fewer days?
user: Alright, can you try for just one night?
system: I was able to book you a room for 1 night at the guesthouse. The reference number is NEZYKV5E. Is there anything else I can do for you?
user: No, that should do it. Thanks so much for your help!
system: Have a great day!"
160,162,160,You are looking for a place to stay. The hotel should be in the east and should have a star of 4. The hotel should include free wifi. Once you find the hotel you want to book it for 6 people and 2 nights starting from friday. If the booking fails how about different hotel in the same  pricerange. Make sure you get the reference number,You are looking for a place to stay. The hotel should be in the east and should have a star of 4. The hotel should include free wifi. Once you find the hotel you want to book it for 6 people and 2 nights starting from friday. If the booking fails how about different hotel in the same  pricerange. Make sure you get the reference number,"user: I'm looking for a place to stay on the east side with 4 stars.
system: The a and b guest house is a 4-star rated guesthouse in the east with a moderate price range. Would you like to make a booking?
user: Does it include free wifi?
system: Yes it does have free internet. Would you like me to book it for you?
user: Yes, can you book it for 6 people? We will arrive on Friday and stay for 2 nights. 
system: I apologize the booking was unsuccessful.  Would you be interested in another hotel?
user: Can you check for a different hotel in the same pricerange?
system: I am sorry there are no others in that price range in any area,would you like to change the star rating to check for others?
user: It does not need to be a guesthouse. Can't you find anything that is east, 4 star with free wifi. That is all I require. Please, its important.
system: I have the carolina bed and breakfast or warkworth house.  Would you like me to try one of those?
user: Yes, one of those will be fine.
system: Your booking at carolina bed and breakfast was successful. Your reference number is PGLREGJ8.
user: Great! Nothing else at the moment, but thank you and goodbye.
system: Okay glad I could be of help."
161,163,161,You are looking for a place to stay. The hotel should be in the type of guesthouse and should have a star of 4. The hotel doesn't need to have free parking and should be in the north. Make sure you get price range and whether they have internet,You are looking for a place to stay. The hotel should be in the type of guesthouse and should have a star of 4. The hotel doesn't need to have free parking and should be in the north. Make sure you get price range and whether they have internet,"user: Good evening. I'm kind of in a situation. The hotel I had planned to stay was overbooked and I need to find me a room pretty quickly. Can you help?
system: There are many hotels available, do you have any preferences to price or area? 
user: Not really. But it should be in the North.
system: There are two hotels on the north end, the Ashley Hotel and the Lovell Lodge. Which would you like?
user: I would prefer a guesthouse that's 4 star rated. Do either of those fit the bill? 
system: No, I'm afraid they're both two stars.  Would you like to try one of them anyway?
user: Do they have free wifi at either of them?
system: Yes both have free internet. Which one do you prefer?
user: I would really like a four star guesthouse in the north area, I don't need parking.
system: Okay, I've found several place that meet those requirements. I suggest the Avalon. Would you like me to make a reservation for you? 
user: First could you tell me the price range for the Avalon? 
system: The price range at the Avalon is moderate. Do you have any more questions?
user: Yes, can you confirm if the Avalon has Internet, please?
system: Yes they does, but no free parking though.
user: Cool. Thanks I'm good now. Goodbye.
system: You have a wonderful day!"
162,164,162,"You are looking for a place to stay. The hotel should be in the east and doesn't need to include internet. The hotel doesn't need to have free parking. If there is no such hotel, how about one that has free wifi. Once you find the hotel you want to book it for 2 people and 5 nights starting from monday. If the booking fails how about different hotel in the same  pricerange. Make sure you get the reference number","You are looking for a place to stay. The hotel should be in the east and doesn't need to include internet. The hotel doesn't need to have free parking. If there is no such hotel, how about one that has free wifi. Once you find the hotel you want to book it for 2 people and 5 nights starting from monday. If the booking fails how about different hotel in the same  pricerange. Make sure you get the reference number","user: I need a place to stay in the East. I don't need to have access to the Internet.
system: I have 7 places available in the east.  What is your price range?
user: Price does not matter, but can you find one without free parking?
system: a and a guest house is available. It's in East part of town and is moderately priced with no free parking. Can I book it for you?
user: does it have free wi fi? I need free wi fi
system: the a nd b guesthouse has wi-fi and fits the rest of your criteria, I can book you if you would like.
user: Yes, please. Can I book it for 2 people on Monday night with a 5 night stay?
system: I'm sorry, that isn't available.  Is there something else I can find for you?
user: How about something else in the same price range?
system: Okay, you're booked at Acorn guest house with reference number HK5AYCB6. May I help with anything else?
user: Can I have the address please?
system: Sure! The address for the acorn guest house is 154 chesterton road cb41da and the phone is 01223353888. 
user: Thank you so much. That is all.
system: Okay. Enjoy your stay here."
163,165,163,You are looking for a place to stay. The hotel should be in the type of guesthouse and should be in the moderate price range. The hotel should include free wifi and should include free parking. Once you find the hotel you want to book it for 6 people and 5 nights starting from saturday. If the booking fails how about different hotel in the same  pricerange. Make sure you get the reference number,You are looking for a place to stay. The hotel should be in the type of guesthouse and should be in the moderate price range. The hotel should include free wifi and should include free parking. Once you find the hotel you want to book it for 6 people and 5 nights starting from saturday. If the booking fails how about different hotel in the same  pricerange. Make sure you get the reference number,"user: I need a place to stay. A guesthouse would be great.
system: Is there a certain side of town you want to be on?
user: No not necessarily. I would like place moderately priced that includes free wifi and also free parking. 
system: I show several hotels that meet those criteria.  What day and how many people are you looking to book for?
user: 6 people for 5 nights starting saturday please.
system: I have that reservation made at the Acorn guest house for 5 nights. 6 people and you guys will arrive on Saturday
user: May I have the reference code please?
system: Booking was unsuccessful. Want to find another hotel?
user: Yes, please find lodging in the same moderate price range for a hotel instead of a guesthouse, if possible.
system: I was able to successfully book you at Ashley Hotel.  The address is  74 chesterton road.  The reference number is GINRZ444.
user: Thank you so much for your help.
system: You are welcome. May I help you with anything else?
user: No, that's all I need. Thanks again.
system: Okay. Enjoy your stay."
164,166,164,You are looking for a place to stay. The hotel should include free wifi and should include free parking. The hotel should be in the type of guesthouse and should have a star of 0. Once you find the hotel you want to book it for 5 people and 3 nights starting from sunday. Make sure you get the reference number,You are looking for a place to stay. The hotel should include free wifi and should include free parking. The hotel should be in the type of guesthouse and should have a star of 0. Once you find the hotel you want to book it for 5 people and 3 nights starting from sunday. Make sure you get the reference number,"user: I am looking for a place to stay and it should include free wifi and free parking.
system: We have quite a few lodgings which offer both. Do you have a preference as to what type of lodging, a guesthouse or hotel?
user: I'm looking for a 0 star guesthouse.
system: I have two options. City Centre North B&B is in the north, and El Shaddai is in the Centre. Do you have a preferencE?
user: How about El Shaddai? I'll book it for 3 nights starting Sunday. There will be 5 of us.
system: Your booking was successful. The reference number is 8JGI0F6Y. Is there anything else I can help you with?
user: That is all! Thanks! 
system: Awesome. Have a good day!"
165,167,165,"You are looking for a place to stay. The hotel should include free parking and doesn't need to include internet. The hotel should be in the type of guesthouse. If there is no such hotel, how about one that has free wifi. Make sure you get address","You are looking for a place to stay. The hotel should include free parking and doesn't need to include internet. The hotel should be in the type of guesthouse. If there is no such hotel, how about one that has free wifi. Make sure you get address","user: I am looking for a place to stay with free parking.
system: We have many places to choose from. Do you have a specific price range or area you want to stay in?
user: No, but I would like a guesthouse.
system: We have 21 of those, would you like to narrow your choices down by location or price range?
user: Can you give me the address of the one you recommend?
system: I recommend the arbury lodge guesthouse on the northside. Its in the moderate price range and its located at 82 arbury road. Will that be all today?
user: Does it have free wifi?
system: Yes, they do offer free wifi and parking. Would you like reservations?
user: I don't need a reservation just yet, but can you give me the address?
system: Absolutely, the address is 82 Arbury Road, CB42JE.  May I help with anything else?
user: No, that is everything, thank you for your help.
system: You are welcome! Have a nice day."
166,168,166,"You are looking for a place to stay. The hotel should be in the expensive price range and should include free parking. The hotel should be in the type of guesthouse and should have a star of 3. If there is no such hotel, how about one that is in the type of hotel. Make sure you get phone number, postcode, and whether they have internet","You are looking for a place to stay. The hotel should be in the expensive price range and should include free parking. The hotel should be in the type of guesthouse and should have a star of 3. If there is no such hotel, how about one that is in the type of hotel. Make sure you get phone number, postcode, and whether they have internet","user: I'm looking for an expensive place to stay with free parking please.
system: Express by Holiday Inn Cambridge is an expensive hotel with free parking. Their phone number is 01223866800.
user: Is it a guesthouse? I'd really like a guesthouse with 3 stars, if possible.
system: Unfortunately, I can't find a 3-star expensive guesthouse with free parking. Would you like me to find something else?
user: How about a hotel instead of a guesthouse? 
system: Sure, The Lensfield hotel is in the south.  It is very nice, can I book it for you?
user: First, can you give me the phone number, postcode, and tell me if they have internet?
system: The Lensfield does have free wifi. Their phone number is 01223355017 and their postcode is cb21en.
user: That is perfect, thank you for your help. Goodbye.
system: Let us know if you have any more questions!"
167,169,167,You are looking for a place to stay. The hotel should include free parking and should be in the south. The hotel should include free wifi. Once you find the hotel you want to book it for 6 people and 4 nights starting from saturday. If the booking fails how about different hotel in the same  pricerange. Make sure you get the reference number,You are looking for a place to stay. The hotel should include free parking and should be in the south. The hotel should include free wifi. Once you find the hotel you want to book it for 6 people and 4 nights starting from saturday. If the booking fails how about different hotel in the same  pricerange. Make sure you get the reference number,"user: I need a room, in the south, free wifi. 
system: I have one hotel and three guesthouses on the southside. Would you like a certain price range or star rating?
user: The price range and star rating is not important to me. 
system: Do you need it to have free parking?
user: No, you can just pick whatever you would recommend.  Can you book a room for 6 people starting on Saturday for 4 nights?
system: Ok, let's book The Lensfield Hotel for you Saturday for 6 people for 4 nights.
user: Great. Can I have the reference number for that reservation?
system: I've booked you at the Lensfield with reference number is PKEIHXCW. Can I help you with anything else?
user: That is all.  Thank you
system: Glad I could help. Enjoy your stay.
user: We will. Have a good day.
system: Thank you so much . Enjoy your stay.
user: You have been super helpful. Good-Bye.
system: Thank for using our service. Goodbye!"
168,170,168,You are looking for a place to stay. The hotel should be in the type of guesthouse and should have a star of 4. The hotel should include free wifi. Once you find the hotel you want to book it for 6 people and 4 nights starting from saturday. If the booking fails how about different hotel in the same  pricerange. Make sure you get the reference number,You are looking for a place to stay. The hotel should be in the type of guesthouse and should have a star of 4. The hotel should include free wifi.,"user: I'm needing a 4 star guest house today.
system: Sure! We have 18 4 star guesthouses, would you like a specific part of town or price range?
user: Do you know if any of them offer free wifi?
system: I have 5 optionsd available,all have WiFi"
169,171,169,"You are looking for a place to stay. The hotel should have a star of 3 and should be in the cheap price range. The hotel should be in the type of hotel and should include free wifi. If there is no such hotel, how about one that is in the expensive price range. Once you find the hotel you want to book it for 5 people and 3 nights starting from sunday. If the booking fails how about different hotel in the same  pricerange. Make sure you get the reference number","You are looking for a place to stay. The hotel should have a star of 3 and should be in the cheap price range. The hotel should be in the type of hotel and should include free wifi. If there is no such hotel, how about one that is in the expensive price range. Once you find the hotel you want to book it for 5 people and 3 nights starting from sunday. If the booking fails how about different hotel in the same  pricerange. Make sure you get the reference number","user: Hi I need a cheap hotel in the three star range, please. 
system: There are no results in this area, but I could try and find something close to that if you'd like?
user: Ok.  I would like it to be a hotel and have free wifi please.
system: The Cambridge Belfry is a 4 star hotel and has both free wifi and parking. Would you like to make a reservation?
user: I am really looking for a hotel that is expensive. Does the Cambridge Belfry fit that description?
system: No.  The Cambridge Belfry is a cheap hotel."
170,172,170,You are looking for a particular hotel. Its name is called home from home. Once you find the hotel you want to book it for 2 people and 4 nights starting from sunday. If the booking fails how about tuesday. Make sure you get the reference number,You are looking for a particular hotel. Its name is called home from home. Once you find the hotel you want to book it for 2 people and 4 nights starting from sunday. If the booking fails how about tuesday. Make sure you get the reference number,"user: I need to find information on home from home.
system: Sure, it is a moderately priced 4 star guesthouse located in the north. Free parking and internet. Would you like to make a booking?
user: Yes, please. There will be 2 of us staying for 4 nights, and we'll arrive on Sunday.
system: I booked you and your Reference number is : LKDT8R8B. Is there anything else?
user: That is great. Thanks.
system: Can I help with anything more?
user: No, that will be all today. Thanks a bunch!
system: Have a great day!"
