,dia_no,new_dia_no,old_goal,new_goal,dia
311,315,311,"You are looking for a place to stay. The hotel should be in the type of guesthouse and doesn't need to include internet. The hotel should be in the south. If there is no such hotel, how about one that has free wifi. Once you find the hotel you want to book it for 6 people and 2 nights starting from tuesday. Make sure you get the reference number","You are looking for a place to stay. The hotel should be in the type of guesthouse and doesn't need to include internet. The hotel should be in the south. If there is no such hotel, how about one that has free wifi. Once you find the hotel you want to book it for 6 people and 2 nights starting from tuesday. Make sure you get the reference number","user: I am looking for a place to stay. The hotel should be in the type of guesthouse and doesn't need to include internet
system: There are many guesthouses that meet your criteria. Do you have a pricerange in mind?
user: I'm looking for something that would be in the middle price point.
system: I have located 15 guesthouse types in the moderate price range. Do you have a preference for a particular area of town?
user: Maybe the south?
system: We have two in the south, a 4 star and a 3 star.  Do you have a preference?
user: I don't care about that.
system: How about the bridge guest house?
user: Does it have free wifi?
system: Yes the bridge guest house has free wifi. Can I book it for you?
user: Yes. There will be six of us staying for two nights.
system: What day did you want to check in?
user: We are actually checking in starting on Tuesday.
system: I was able to book the Bridge Guest House for 6 people starting Tuesday for 2 nights. Is there anything else I can help you with?
user: Yes, can i have a reference number please?
system: Of course.  Reference number COIMDB7B.  Can I help with anything else today?
user: Nope, that's all I need for today. Thank you!
system: Thank you as well, let us know if you need help with anything else."
312,316,312,"You are looking for a place to stay. The hotel should be in the cheap price range and should be in the type of hotel. The hotel should be in the centre and should have a star of 0. If there is no such hotel, how about one that is in the type of guesthouse. Once you find the hotel you want to book it for 8 people and 5 nights starting from sunday. If the booking fails how about 1 nights. Make sure you get the reference number","You are looking for a place to stay. The hotel should be in the cheap price range and should be in the type of hotel. The hotel should be in the centre and should have a star of 0. If there is no such hotel, how about one that is in the type of guesthouse. Once you find the hotel you want to book it for 8 people and 5 nights starting from sunday. If the booking fails how about 1 nights. Make sure you get the reference number","user: Greetings! I need a cheap hotel to stay the night in, could you help me?
system: I certainly can. I have about 10 available. Do you prefer a certain area of town?
user: I would prefer a 0 star rating in the centre of town
system: The El Shaddai is a guesthouse with 0 stars in the centre of town. Would you like me to book it for you?
user: Yes, as long as it falls in the cheap price range, please.
system: Is it for just yourself? For how long and on what day? 
user: The reservation should be for 8 people for 5 nights starting Sunday. Thank you.
system: I was unable to book that for you. Perhaps we can try another day or a shorter stay?
user: How about just one night?
system: I have you down for one night.  Your reference number is NF64LM1Z.  Anything else?
user: That's all I need right now, thanks. 
system: Have a great day!"
313,317,313,You are looking for a particular hotel. Its name is called leverton house. Once you find the hotel you want to book it for 8 people and 4 nights starting from saturday. If the booking fails how about different hotel in the same  pricerange. Make sure you get the reference number,You are looking for a particular hotel. Its name is called leverton house. Once you find the hotel you want to book it for 8 people and 4 nights starting from saturday. If the booking fails how about different hotel in the same  pricerange. Make sure you get the reference number,"user: I am looking for a hotel called the leverton house.
system: May I suggest the guesthouse called the Leverton House.
user: Yes, that is the one I wanted. Could I book a four night stay starting on Saturday?
system: How many people will be staying?
user: There will be a total of 8 of us. 
system: I'm sorry, it doesn't look like they have rooms available. Would you like me to try a different hotel?
user: Sure.  You can try something different as long as it is in the same price range as Leverton House.
system: I was able to book allenbell, reference number is KZBURD59.
user: Thank you! good bye.
system: Enjoy your stay."
314,318,314,"You are looking for a place to stay. The hotel should be in the west and should include free wifi. The hotel should be in the type of guesthouse and should be in the moderate price range. Make sure you get whether they have free parking, postcode, and address","You are looking for a place to stay. The hotel should be in the west and should include free wifi. The hotel should be in the type of guesthouse and should be in the moderate price range. Make sure you get whether they have free parking, postcode, and address","user: I'm looking for a place to stay in with free wifi in the west part of town.
system: How about the Hobsons House?
user: Is that a guesthouse? I like the guesthouse style, and I also need something that's moderately priced.
system: Yes it is a moderately priced guesthouse. Would you like me to make a reservation for you?
user: Not yet.  Can I have the address there though?
system: Sure, it is 96 Barton Road.
user: Can I also get the postcode? And do they have free parking?
system: They have free parking. Postcode is cb39lh. Anything else you need?
user: No, that's all. Thanks!
system: Alright. You're all set. Enjoy!"
315,319,315,"You are looking for a place to stay. The hotel should include free parking and should have a star of 0. The hotel should be in the expensive price range. If there is no such hotel, how about one that has a star of 4. Once you find the hotel you want to book it for 2 people and 4 nights starting from monday. If the booking fails how about different hotel in the same  pricerange. Make sure you get the reference number",You are looking for a place to stay. The hotel should include free parking and should have a star of 0. The hotel should be in the expensive price range. Once you find the hotel you want to book it for 2 people and 4 nights starting from monday. If the booking fails how about different hotel in the same pricerange. Make sure you get the reference number ,"user: Hey I'm looking for a hotel that has free parking, can you find one?
system: Sure, there are quite a few hotels that offer parking. Any particular area or price range you looking for?
user: I am looking for one in the expensive price range
system: The Huntingdon Marriott Hotel I believe would be fine. Thank you.
user: Is the huntingdon marriott a hotel with free parking, expensive and a 0 star.If so, that would be great.
system: How many nights will you be staying and for how many people?
user: Two guests will be staying for 4 nights beginning on Monday.
system: I'm sorry I could not book you there. Could we try another hotel?
user: Yes please but it needs to be in the same price range.
system: I don not have anything in the same price range in the West. Would you like to try another part of town or different price range?
user: Yes one in the same price range.
system: I have an Express by Holiday Inn Cambridge. Would you like me to try to book you there?
user: Yes, if you could. That would be great.
system: That one was successful! Your reference number is 057SX3X0.
user: Thanks, that's all I need today. Goodbye!
system: Let me know if you would my assistance. Goodbye!"
316,320,316,You are looking for a place to stay. The hotel should include free parking and should be in the cheap price range. The hotel should have a star of 4. Once you find the hotel you want to book it for 4 people and 5 nights starting from thursday. Make sure you get the reference number,You are looking for a place to stay. The hotel should be in the cheap price range. The hotel should have a star of 4. Once you find the hotel you want to book it for 4 people and 5 nights starting from thursday. Make sure you get the reference number,"user: I'm looking for cheap lodgings.
system: Alexander Bed and Breakfast is an option. It is located at 56 Saint Barnabas Road.
user: What's it's star rating?
system: It has a 4 star rating. Would you like me to book a room for you?
user: Yes. I need it for four people and five nights. 
system: What day do you want that booking to start?
user: I need it to start Thursday night and once it is booked, can you send me the reference number?
system: You're all set! Your reference number is XZY6OUBQ. Anything else I can help you with?
user: No, I'll let you know if anything else comes up.
system: OK, have a great day. Don't hesitate to contact us if you think of something you do need."
317,321,317,You are looking for a place to stay. The hotel should be in the type of guesthouse and should be in the centre. The hotel should include free parking. Make sure you get whether they have internet,You are looking for a place to stay. The hotel should be in the type of guesthouse and should be in the centre. The hotel should include free parking. Make sure you get whether they have internet,"user: Hello, I am looking for a guesthouse located in the centre
system: Ok, there are 2 guesthouses located in the centre of town. They are in the cheap price range. Would you like to book one?
user: Do they both include free parking?
system: Yes, they both have free parking.
user: How about internet? Can I get wifi for free?
system: Yes, they both have free wifi as well. 
user: Thank you, that's all. Goodbye.
system: Not a problem. If you need more assistance, let me know."
318,322,318,You are looking for a place to stay. The hotel should include free parking and should be in the type of guesthouse. The hotel should have a star of 4 and should be in the west. Once you find the hotel you want to book it for 7 people and 2 nights starting from saturday. Make sure you get the reference number,You are looking for a place to stay. The hotel should include free parking and should be in the type of guesthouse. The hotel should have a star of 4 and should be in the west. Once you find the hotel you want to book it for 7 people and 2 nights starting from saturday. Make sure you get the reference number,"user: I am looking for a place to stay. The hotel should include free parking and should be in the type of guesthouse
system: What area of town?
user: It should be in the west and have a star rating of 4.
system: how about finches bed and breakfast?
user: I'd like to book for 7 people 2 nights on saturday please
system: Booking was successful. Reference number is : FNAJHEWG.
user: Thank you for your help
system: Is there anything else I can help you with?
user: No, there's nothing more.
system: Thank you for contacting us. Have a great day!"
319,323,319,You are looking for a place to stay. The hotel should be in the moderate price range and should have a star of 4. The hotel should include free parking and should be in the east. Once you find the hotel you want to book it for 4 people and 5 nights starting from sunday. If the booking fails how about different hotel in the same  pricerange. Make sure you get the reference number,You are looking for a place to stay. The hotel should be in the moderate price range and should have a star of 4. The hotel should include free parking and should be in the east. Once you find the hotel you want to book it for 4 people and 5 nights starting from sunday. If the booking fails how about other star rating hotels in the same pricerange with parking and in the east. Make sure you get the reference number,"user: I'm looking for a moderately priced 4 star hotel.
system: We have no hotels with that criteria, but I can search for a 3-5 star hotel if you'd like.
user: The hotel should include free parking and should be in the east
system: Ok we have two guesthouses with that criteria, the Carolina Bed and Breakfast, and the Warkworth House.
user: I need a reservation for 4 people for 5 nights starting on Sunday
system: I was able to book you at Warkworth House, the reference number is VTZK341T. Can I help you with anything else?
user: No that is perfect. Thank you very much.
system: You are welcome. Thank you for calling the Cambridge TownInfo Centre. Good bye."
320,324,320,You are looking for a place to stay. The hotel should include free parking and should be in the cheap price range. The hotel should be in the type of guesthouse. Once you find the hotel you want to book it for 5 people and 4 nights starting from thursday. Make sure you get the reference number,You are looking for a place to stay. The hotel should include free parking and should be in the cheap price range. The hotel should be in the type of guesthouse. Once you find the hotel you want to book it for 5 people and 4 nights starting from thursday. Make sure you get the reference number,"user: Any chance you can direct me to where I can locate a cheap room for the night?
system: Sure, we have a lot of cheap places to stay. Is there an area of town that you prefer? 
user: A guest house, with free parking, would be just the thing.
system: Might I suggest the Alexander Bed and Breakfast? They're cheaply priced, ranked 4 stars, and they do offer free parking.
user: That sounds perfect, actually. Can you book me a room on Thursday for 5 people for a 4 night stay? 
system: That booking was successful, your reference number is D3Q7SAFM. Is there anything else I can do for you today?
user: No, that gives me everything I need.
system: OK great.  Have a nice day.  Bye."
321,325,321,You are looking for a place to stay. The hotel should be in the type of guesthouse and should be in the east. The hotel should include free parking. Once you find the hotel you want to book it for 3 people and 5 nights starting from thursday. Make sure you get the reference number,You are looking for a place to stay. The hotel should be in the type of guesthouse and should be in the east. The hotel should include free parking. Once you find the hotel you want to book it for 3 people and 5 nights starting from thursday. If booking fails how about 3 nights. Make sure you get the reference number,"user: Good Afternoon, I am looking for a place to stay on the east side in a guest house
system: There are 6 possible places that fit your request. Would you like more information or to add additional search preferences?
user: Can you see if any of them offer free parking? 
system: 5 of the guesthouses offer parking. What is your price range preference? 
user: Honestly, any price range will do. Can you suggest one for me and help me with booking a room? 
system: Absolutely. Can I suggest the Warkworth House at a moderate price range, or the Autumn House at a cheap price range. Do either of these interest you?
user: I would consider both.  I need to book for three people and 5 nights starting on Thursday.  Can either of them offer that?
system: I am having difficulty booking either of the. Can you find another day or time that would suit you?
user: I really need to stay during that time frame. Would you mind checking again?
system: OK, you're all booked for 3 nights at the Warkworth House, starting Thursday. Your reference number is AC1NVW47. Can I help with anything else today?
user: No, that will be all. Thanks!
system: You're welcome. Goodbye!"
322,326,322,"You are looking for a place to stay. The hotel doesn't need to have free parking and should be in the cheap price range. The hotel should be in the type of guesthouse. If there is no such hotel, how about one that is in the moderate price range. Make sure you get whether they have internet and phone number","You are looking for a place to stay. The hotel doesn't need to have free parking and should be in the cheap price range. The hotel should be in the type of guesthouse. If there is no such hotel, how about one that is in the moderate price range. Make sure you get whether they have internet and phone number","user: I need a cheap hotel.
system: I found ten results! What area of town would you like?
user: Hmm, I'm not sure. I am looking for a guesthouse type, though, and it doesn't need to have free parking.
system: I have 9 that matches your needs. Shall I recommend a nice one?
user: I would prefer one in the cheap range, a moderately priced one is fine if a cheap one isn't there.
system: The alexander bed and breakfast is a good option.
user: Does The Alexander have internet? 
system: Yes, it does have internet! Would you like me to book that for you?
user: Not yet, can I get the phone number?
system: Their number is 01223525725.
user: That's all. Thanks!
system: Thank you, good day to you."
323,328,323,You are looking for a place to stay. The hotel should be in the east and should include free parking. The hotel should be in the cheap price range and should be in the type of guesthouse. Once you find the hotel you want to book it for 5 people and 5 nights starting from monday. If the booking fails how about different hotel in the same  pricerange. Make sure you get the reference number,You are looking for a place to stay. The hotel should be in the east. The hotel should be in the cheap price range and should be in the type of guesthouse. Once you find the hotel you want to book it for 5 people and 5 nights starting from monday. If the booking fails how about different hotel in the same pricerange. Make sure you get the reference number,"user: I am looking for somewhere to stay in the east.
system: There are 7 hotels in the east. Do you have a price range or other needs to narrow them down?
user: Yes, I would like it to be cheap and a type of guesthouse.
system: I have three hotels that meet your needs.  Would you like more information on them?
user: Which one would be available to book 5 people for 5 nights starting this Monday?
system: I was able to book you in the Autumn House with reference number 8BCYNW35. May I help with anything else?
user: That is all.  Thank you.
system: Let us know if we can help further. Good day."
324,329,324,You are looking for a particular hotel. Its name is called aylesbray lodge guest house. Once you find the hotel you want to book it for 7 people and 2 nights starting from sunday. If the booking fails how about 1 nights. Make sure you get the reference number,You are looking for a particular hotel. Its name is called aylesbray lodge guest house. Once you find the hotel you want to book it for 7 people and 2 nights starting from sunday. If the booking fails how about 1 nights. Make sure you get the reference number,"user: I am looking for a hotel called Aylesbray Lodge Guest House.
system: There is an Aylesbray Lodge Guest House located at 5 Mowbray Road. Would you like me to provide you with any more information or help you book the hotel?
user: Great I am going to need that hotel for 7 people and two nights starting sunday
system: I'm sorry, I can't book at Aylesbray Lodge for 2 days. Would you like a shorter stay?
user: Yes, 1 night is fine.
system: Great, you're all set. Your reference number is WK3E72PX
user: Thank you. Good-bye.
system: thank you very much bye"
325,330,325,You are looking for a particular hotel. Its name is called bridge guest house. Once you find the hotel you want to book it for 7 people and 2 nights starting from monday. Make sure you get the reference number,You are looking for a particular hotel. Its name is called bridge guest house. Once you find the hotel you want to book it for 7 people and 2 nights starting from monday. Make sure you get the reference number,"user: I would like to get information on the bridge guest house.
system: I can definitely help with that. It's moderately priced and is located in the south. They offer free wifi and parking. Would you like help booking a room with them?
user: Thanks! I will book the hotel for 7 people for 2 nights starting from Monday.
system: The booking was successful! Your reference number is 6NEWYJ6Y. Can I help you with anything else?
user: No, that's all for me today. Goodbye!
system: Okay.  Glad we could help!"
326,331,326,You are looking for a place to stay. The hotel doesn't need to have free parking and should be in the type of guesthouse. The hotel should be in the north. Once you find the hotel you want to book it for 4 people and 4 nights starting from thursday. If the booking fails how about different hotel in the same  pricerange. Make sure you get the reference number,You are looking for a place to stay. The hotel doesn't need to have free parking and should be in the type of guesthouse. The hotel should be in the north. Once you find the hotel you want to book it for 4 people and 4 nights starting from thursday. If the booking fails how about different hotel in the same  pricerange. Make sure you get the reference number,"user: I need a place to stay please. A guesthouse would be great.
system: Acorn guest house has good ratings would you like to stay there?
user: Is it in the north? I need to be in the north area of the city.
system: Yes, Acorn Guest House is a 4 star guest house with free internet and free parking in the north part of town. Should I book it for you?
user: Yes, please book starting Thursday for 4 people and for 4 nights.
system: I'm sorry, there were no rooms available. Would you like to find another hotel?
user: Could you try another hotel in the same price range and, if you make a reservation, give me the reference number?
system: Will you be needing free parking?
user: I do not need free parking.
system: Acorn guest house is in the moderate price range, are you looking to book in that pricerange then?
user: Yes, that would be fine, moderate price range.
system: The Acorn is not available but I went ahead and booked the alpha-milton guest house. Your reference number is SJZ9ZJ8V.
user: Good. Thanks for your help.
system: You are welcome. Enjoy your stay."
327,332,327,"You are looking for a place to stay. The hotel should be in the north and should be in the type of guesthouse. The hotel should be in the moderate price range and should include free parking. Make sure you get star of the hotel, address, and phone number","You are looking for a place to stay. The hotel should be in the north and should be in the type of guesthouse. The hotel should be in the moderate price range and should include free parking. Make sure you get star of the hotel, address, and phone number","user: Can you help me find a guesthouse in the north?
system: We have 11 guesthouses available in the area, what is your price range and what amenities would you like in the guesthouse?
user: It should include free parking.
system: how about acorn house?
user: Is it in the moderate range?
system: yes.its within the moderate range
user: What is the star rating of this guest house, address and phone number?
system: The star rating is 4. Their phone number is 01223353888. The address is 154 chesterton road, postcode cb41da.
user: Great, just gathering information for now. That's everything I needed, thanks.
system: Glad I was able to help. Thank you.
user: You're welcome. 
system: Call us again, sir. Have a nice day. Goodbye."
328,333,328,"You are looking for a place to stay. The hotel should have a star of 4 and should be in the south. The hotel should be in the expensive price range and should include free wifi. If there is no such hotel, how about one that is in the centre. Make sure you get whether they have free parking, hotel type, and phone number","You are looking for a place to stay. It should have a star of 4 and should be in the south. If there is no such hotel, how about one that is in the centre.","user: I am looking for a place to stay in the south.
system: There are 4 places in the south. 3 guesthouses and 1 hotel. Which would you prefer?
user: I am looking to stay at a place with four stars, please.
system: The aylesbray lodge guest house is a 4 star hotel located at 5 mowbray road.
user: thank you for the help
system: Great! Have a nice day!"
329,334,329,You are looking for a place to stay. The hotel should include free parking and should be in the type of guesthouse. The hotel should have a star of 4. Make sure you get address,You are looking for a place to stay. The hotel should include free parking and should be in the type of guesthouse. The hotel should have a star of 4. Make sure you get address,"user: I am looking for a guesthouse that has free parking.
system: What price range are you looking for?
user: I don't care about that. I do want a place with a 4-star rating.
system: There are 16 entries here. Personally I recommend allenbell. 
user: That sounds good as long as it's got parking. Can you get me the address?
system: How about the Allenbell? The address is 517a coldham lane.
user: Sounds great.  Thanks for your help, that is all I need.  Bye.
system: Thank you and have a great day, goodbye."
